{
  "$schema": "https://json-schema.org/draft/2020-12/schema",
  "$id": "https://w3id.org/xapi/aclit/v1/schemas/peer-review-submitted",
  "title": "Peer Review Submitted",
  "description": "Validates an xAPI statement generated when a student submits a peer review of another student's writing.",
  "type": "object",
  "required": ["actor", "verb", "object", "result", "context", "timestamp"],
  "$defs": {
    "account": {
      "type": "object",
      "required": ["homePage", "name"],
      "properties": {
        "homePage": { "type": "string", "format": "uri" },
        "name": { "type": "string" }
      }
    }
  },
  "properties": {
    "id": { "type": "string", "format": "uuid" },
    "actor": {
      "type": "object",
      "required": ["objectType", "account"],
      "properties": {
        "objectType": { "const": "Agent" },
        "account": { "$ref": "#/$defs/account" }
      }
    },
    "verb": {
      "type": "object",
      "required": ["id"],
      "properties": {
        "id": { "const": "http://activitystrea.ms/schema/1.0/submit" },
        "display": { "type": "object" }
      }
    },
    "object": {
      "type": "object",
      "required": ["objectType", "id", "definition"],
      "properties": {
        "objectType": { "const": "Activity" },
        "id": { "type": "string", "format": "uri" },
        "definition": {
          "type": "object",
          "required": ["type"],
          "properties": {
            "type": { "const": "https://w3id.org/xapi/aclit/v1/activity-types/peer-review" }
          }
        }
      }
    },
    "result": {
      "type": "object",
      "required": ["completion", "extensions"],
      "properties": {
        "completion": { "type": "boolean" },
        "extensions": {
          "type": "object",
          "required": ["https://w3id.org/xapi/aclit/v1/extensions/feedback-text"],
          "properties": {
            "https://w3id.org/xapi/aclit/v1/extensions/feedback-text": { "type": "string" }
          }
        }
      }
    },
    "context": {
      "type": "object",
      "required": ["contextActivities"],
      "properties": {
        "contextActivities": {
          "type": "object",
          "required": ["parent", "grouping", "category"],
          "properties": {
            "parent": {
              "type": "array",
              "minItems": 1,
              "contains": {
                "type": "object",
                "required": ["id", "definition"],
                "properties": {
                  "id": { "type": "string", "format": "uri" },
                  "definition": {
                    "type": "object",
                    "required": ["type"],
                    "properties": {
                      "type": { "const": "https://w3id.org/xapi/aclit/v1/activity-types/writing-task" }
                    }
                  }
                }
              }
            },
            "grouping": {
              "type": "array",
              "minItems": 1,
              "contains": {
                "type": "object",
                "required": ["id", "definition"],
                "properties": {
                  "id": { "type": "string", "format": "uri" },
                  "definition": {
                    "type": "object",
                    "required": ["type"],
                    "properties": {
                      "type": { "const": "https://w3id.org/xapi/aclit/v1/activity-types/session" }
                    }
                  }
                }
              }
            },
            "category": {
              "type": "array",
              "minItems": 1,
              "contains": {
                "type": "object",
                "required": ["id"],
                "properties": {
                  "id": { "const": "https://w3id.org/xapi/aclit/v1" }
                }
              }
            }
          }
        }
      }
    },
    "timestamp": { "type": "string", "format": "date-time" }
  }
}
